{
  "id": "search-legal-documents",
  "name": "Search Legal Documents",
  "description": "Search Supreme Court cases, founding documents, and amendments",
  "version": "1.0.0",
  "category": "chat-tool",
  "status": "active",
  "brand": "evident",
  "entryPoint": "services/tool_implementations.py#search_legal_documents",
  "capabilities": ["legal.read", "search"],
  "tags": ["legal", "search", "chat", "supreme-court"],
  "author": "Evident Technologies",
  "license": "proprietary"
}
