{
  "id": "bates-generator",
  "name": "Bates Number Generator",
  "description": "Sequential Bates number generation for document production and discovery",
  "version": "1.0.0",
  "category": "algorithm",
  "status": "active",
  "brand": "evident",
  "entryPoint": "algorithms/bates_generator.py",
  "capabilities": ["evidence.write"],
  "tags": ["bates", "production", "ediscovery", "numbering"],
  "author": "Evident Technologies",
  "license": "proprietary"
}
