{
  "id": "integrity-sweep",
  "name": "Integrity Sweep",
  "description": "Full integrity verification sweep across evidence store",
  "version": "1.0.0",
  "category": "algorithm",
  "status": "active",
  "brand": "evident",
  "entryPoint": "algorithms/integrity_sweep.py",
  "capabilities": ["evidence.read", "audit.write"],
  "tags": ["integrity", "verification", "ediscovery"],
  "author": "Evident Technologies",
  "license": "proprietary"
}
