{
  "id": "geneva-bible-study-t",
  "name": "Geneva Bible Study Tool",
  "description": "Geneva Bible study — verse navigation, keyword search, notes, highlights, reading plans",
  "version": "1.0.0",
  "category": "app",
  "status": "active",
  "brand": "evident",
  "entryPoint": "apps/geneva-bible-study-t/index.html",
  "capabilities": ["read"],
  "tags": ["study", "bible", "reference", "mobile"],
  "author": "Evident Technologies",
  "license": "proprietary"
}
