{
  "id": "civics-hierarchy",
  "name": "Civics Hierarchy",
  "description": "Interactive legal education tool — Constitution, case law, federal register, treaties, citation library",
  "version": "1.0.0",
  "category": "app",
  "status": "active",
  "brand": "evident",
  "entryPoint": "apps/civics-hierarchy/index.html",
  "capabilities": ["legal.read", "search"],
  "tags": ["legal", "education", "constitution", "case-law"],
  "author": "Evident Technologies",
  "license": "proprietary"
}
